{
  "$schema": "https://raw.githubusercontent.com/dawidsok/dim-sum-theme/main/scheme/schema.json",
  "name": "Dim Sum Mono",
  "slug": "dim-sum-mono",
  "appearance": "dark",
  "description": "A strictly monochrome dark Dim Sum variant with greyscale UI and code syntax.",
  "colors": {
    "bg": "#0f0f0f",
    "bg1": "#181818",
    "bg2": "#222222",
    "bg3": "#2e2e2e",
    "bg4": "#3a3a3a",
    "dim": "#5e5e5e",
    "mid": "#8a8a8a",
    "fg": "#d0d0d0",
    "fg1": "#e0e0e0",
    "white": "#f2f2f2",
    "red": "#9a9a9a",
    "orange": "#a4a4a4",
    "yellow": "#b0b0b0",
    "green": "#b8b8b8",
    "cyan": "#c0c0c0",
    "blue": "#acacac",
    "purple": "#a0a0a0",
    "magenta": "#969696",
    "brightRed": "#b4b4b4",
    "brightGreen": "#c6c6c6",
    "brightYellow": "#d6d6d6",
    "brightBlue": "#bebebe",
    "brightPurple": "#cacaca",
    "brightCyan": "#d0d0d0"
  },
  "ansi": {
    "black": "bg",
    "red": "red",
    "green": "green",
    "yellow": "yellow",
    "blue": "blue",
    "magenta": "purple",
    "cyan": "cyan",
    "white": "fg",
    "brightBlack": "dim",
    "brightRed": "brightRed",
    "brightGreen": "brightGreen",
    "brightYellow": "brightYellow",
    "brightBlue": "brightBlue",
    "brightMagenta": "brightPurple",
    "brightCyan": "brightCyan",
    "brightWhite": "white"
  },
  "ui": {
    "background": "bg",
    "foreground": "fg",
    "cursor": "white",
    "cursorText": "bg",
    "selectionBackground": "bg3",
    "selectionForeground": "white",
    "border": "bg3",
    "borderMuted": "dim",
    "lineNumber": "dim",
    "lineNumberActive": "white",
    "panel": "bg1",
    "panelAlt": "bg2"
  },
  "syntax": {
    "comment": "mid",
    "keyword": "white",
    "function": "fg1",
    "string": "fg",
    "number": "fg1",
    "constant": "fg1",
    "type": "white",
    "property": "fg",
    "punctuation": "dim",
    "operator": "fg1",
    "preproc": "fg1",
    "error": "brightRed",
    "warning": "brightYellow",
    "info": "brightBlue",
    "hint": "brightCyan",
    "added": "brightGreen",
    "changed": "brightYellow",
    "removed": "brightRed"
  }
}
