{
  "$schema": "https://raw.githubusercontent.com/dawidsok/dim-sum-theme/main/scheme/schema.json",
  "name": "Dim Sum Sunset",
  "slug": "dim-sum-sunset",
  "appearance": "dark",
  "description": "A dim dark Dim Sum variant with barely warm dusk surfaces and muted ember accents.",
  "colors": {
    "bg": "#151312",
    "bg1": "#1f1c1a",
    "bg2": "#292520",
    "bg3": "#352f29",
    "bg4": "#423a32",
    "dim": "#61564d",
    "mid": "#8d7d6f",
    "fg": "#d1c6ba",
    "fg1": "#ded2c4",
    "white": "#efe1d1",
    "red": "#b5655d",
    "orange": "#c27a48",
    "yellow": "#bd9858",
    "green": "#8a9161",
    "cyan": "#6f9891",
    "blue": "#7890aa",
    "purple": "#987fa2",
    "magenta": "#aa7488",
    "brightRed": "#cf786d",
    "brightGreen": "#9da36f",
    "brightYellow": "#d0aa68",
    "brightBlue": "#8aa4bf",
    "brightPurple": "#ad92b8",
    "brightCyan": "#82aca5"
  },
  "ansi": {
    "black": "bg",
    "red": "red",
    "green": "green",
    "yellow": "yellow",
    "blue": "blue",
    "magenta": "magenta",
    "cyan": "cyan",
    "white": "fg",
    "brightBlack": "dim",
    "brightRed": "brightRed",
    "brightGreen": "brightGreen",
    "brightYellow": "brightYellow",
    "brightBlue": "brightBlue",
    "brightMagenta": "brightPurple",
    "brightCyan": "brightCyan",
    "brightWhite": "white"
  },
  "ui": {
    "background": "bg",
    "foreground": "fg",
    "cursor": "white",
    "cursorText": "bg",
    "selectionBackground": "bg3",
    "selectionForeground": "white",
    "border": "bg3",
    "borderMuted": "dim",
    "lineNumber": "dim",
    "lineNumberActive": "white",
    "panel": "bg1",
    "panelAlt": "bg2"
  },
  "syntax": {
    "comment": "mid",
    "keyword": "purple",
    "function": "orange",
    "string": "green",
    "number": "yellow",
    "constant": "yellow",
    "type": "cyan",
    "property": "blue",
    "punctuation": "mid",
    "operator": "fg1",
    "preproc": "magenta",
    "error": "red",
    "warning": "yellow",
    "info": "blue",
    "hint": "cyan",
    "added": "green",
    "changed": "yellow",
    "removed": "red"
  }
}
