{
  "$schema": "https://raw.githubusercontent.com/dawidsok/dim-sum-theme/main/scheme/schema.json",
  "name": "Dim Sum Wave",
  "slug": "dim-sum-wave",
  "appearance": "dark",
  "description": "A dim dark Dim Sum variant with ink-like surfaces, wave blues, and muted autumn accents.",
  "colors": {
    "bg": "#15161b",
    "bg1": "#1c1d23",
    "bg2": "#24252c",
    "bg3": "#30313a",
    "bg4": "#3b3d48",
    "dim": "#545666",
    "mid": "#7f8496",
    "fg": "#c9c4aa",
    "fg1": "#d7d1b8",
    "white": "#e7dfc6",
    "red": "#b46d6a",
    "orange": "#bd8258",
    "yellow": "#c1a35f",
    "green": "#8a9a68",
    "cyan": "#6a9a95",
    "blue": "#738aa8",
    "purple": "#9380a3",
    "magenta": "#a07b94",
    "brightRed": "#cf807b",
    "brightGreen": "#9dae77",
    "brightYellow": "#d3b46d",
    "brightBlue": "#859dbc",
    "brightPurple": "#a491b8",
    "brightCyan": "#7db0ab"
  },
  "ansi": {
    "black": "bg",
    "red": "red",
    "green": "green",
    "yellow": "yellow",
    "blue": "blue",
    "magenta": "purple",
    "cyan": "cyan",
    "white": "fg",
    "brightBlack": "dim",
    "brightRed": "brightRed",
    "brightGreen": "brightGreen",
    "brightYellow": "brightYellow",
    "brightBlue": "brightBlue",
    "brightMagenta": "brightPurple",
    "brightCyan": "brightCyan",
    "brightWhite": "white"
  },
  "ui": {
    "background": "bg",
    "foreground": "fg",
    "cursor": "white",
    "cursorText": "bg",
    "selectionBackground": "bg3",
    "selectionForeground": "white",
    "border": "bg3",
    "borderMuted": "dim",
    "lineNumber": "dim",
    "lineNumberActive": "white",
    "panel": "bg1",
    "panelAlt": "bg2"
  },
  "syntax": {
    "comment": "mid",
    "keyword": "purple",
    "function": "blue",
    "string": "green",
    "number": "orange",
    "constant": "orange",
    "type": "cyan",
    "property": "cyan",
    "punctuation": "mid",
    "operator": "fg1",
    "preproc": "yellow",
    "error": "red",
    "warning": "yellow",
    "info": "blue",
    "hint": "cyan",
    "added": "green",
    "changed": "yellow",
    "removed": "red"
  }
}
