{
  "$schema": "https://raw.githubusercontent.com/dawidsok/dim-sum-theme/main/scheme/schema.json",
  "name": "Dim Sum Paper",
  "slug": "dim-sum-paper",
  "appearance": "light",
  "description": "A barely warm, steam-bun-paper light Dim Sum variant with soft ink and muted syntax color.",
  "colors": {
    "bg": "#f7f6f1",
    "bg1": "#efede7",
    "bg2": "#e6e2d9",
    "bg3": "#d8d3c8",
    "bg4": "#c7c0b4",
    "dim": "#a09a8f",
    "mid": "#767168",
    "fg": "#4b4740",
    "fg1": "#3b3832",
    "white": "#24231f",
    "red": "#985f5b",
    "orange": "#9a7252",
    "yellow": "#8b7b52",
    "green": "#687a5a",
    "cyan": "#5f807d",
    "blue": "#637c99",
    "purple": "#766f8d",
    "magenta": "#8a6b7e",
    "brightRed": "#af716c",
    "brightGreen": "#788b69",
    "brightYellow": "#9f8d60",
    "brightBlue": "#748fac",
    "brightPurple": "#8880a2",
    "brightCyan": "#6f928e"
  },
  "ansi": {
    "black": "fg1",
    "red": "red",
    "green": "green",
    "yellow": "yellow",
    "blue": "blue",
    "magenta": "purple",
    "cyan": "cyan",
    "white": "bg2",
    "brightBlack": "mid",
    "brightRed": "brightRed",
    "brightGreen": "brightGreen",
    "brightYellow": "brightYellow",
    "brightBlue": "brightBlue",
    "brightMagenta": "brightPurple",
    "brightCyan": "brightCyan",
    "brightWhite": "bg"
  },
  "ui": {
    "background": "bg",
    "foreground": "fg",
    "cursor": "white",
    "cursorText": "bg",
    "selectionBackground": "bg3",
    "selectionForeground": "white",
    "border": "bg3",
    "borderMuted": "dim",
    "lineNumber": "dim",
    "lineNumberActive": "white",
    "panel": "bg1",
    "panelAlt": "bg2"
  },
  "syntax": {
    "comment": "mid",
    "keyword": "purple",
    "function": "blue",
    "string": "green",
    "number": "orange",
    "constant": "orange",
    "type": "cyan",
    "property": "cyan",
    "punctuation": "mid",
    "operator": "fg1",
    "preproc": "yellow",
    "error": "red",
    "warning": "yellow",
    "info": "blue",
    "hint": "cyan",
    "added": "green",
    "changed": "yellow",
    "removed": "red"
  }
}
