{
  "$schema": "https://raw.githubusercontent.com/dawidsok/dim-sum-theme/main/scheme/schema.json",
  "name": "Dim Sum",
  "slug": "dim-sum",
  "appearance": "dark",
  "description": "A dim Flexoki-inspired warm dark theme with calm UI and muted syntax color.",
  "colors": {
    "bg": "#100f0f",
    "bg1": "#1c1b1a",
    "bg2": "#282726",
    "bg3": "#343331",
    "bg4": "#403e3c",
    "dim": "#575653",
    "mid": "#878580",
    "fg": "#cecdc3",
    "fg1": "#dad8ce",
    "white": "#e6e4d9",
    "red": "#a85f59",
    "orange": "#b77a4a",
    "yellow": "#b3954d",
    "green": "#87965f",
    "cyan": "#5f9b95",
    "blue": "#6f8faf",
    "purple": "#8b7fa8",
    "magenta": "#a06f8c",
    "brightRed": "#c8736d",
    "brightGreen": "#9aa96d",
    "brightYellow": "#c4a55a",
    "brightBlue": "#83a2c2",
    "brightPurple": "#9f91bc",
    "brightCyan": "#73aaa5"
  },
  "ansi": {
    "black": "bg",
    "red": "red",
    "green": "green",
    "yellow": "yellow",
    "blue": "blue",
    "magenta": "purple",
    "cyan": "cyan",
    "white": "fg",
    "brightBlack": "dim",
    "brightRed": "brightRed",
    "brightGreen": "brightGreen",
    "brightYellow": "brightYellow",
    "brightBlue": "brightBlue",
    "brightMagenta": "brightPurple",
    "brightCyan": "brightCyan",
    "brightWhite": "white"
  },
  "ui": {
    "background": "bg",
    "foreground": "fg",
    "cursor": "white",
    "cursorText": "bg",
    "selectionBackground": "bg3",
    "selectionForeground": "white",
    "border": "bg3",
    "borderMuted": "dim",
    "lineNumber": "dim",
    "lineNumberActive": "white",
    "panel": "bg1",
    "panelAlt": "bg2"
  },
  "syntax": {
    "comment": "mid",
    "keyword": "purple",
    "function": "blue",
    "string": "green",
    "number": "orange",
    "constant": "orange",
    "type": "cyan",
    "property": "cyan",
    "punctuation": "mid",
    "operator": "fg1",
    "preproc": "yellow",
    "error": "red",
    "warning": "yellow",
    "info": "blue",
    "hint": "cyan",
    "added": "green",
    "changed": "yellow",
    "removed": "red"
  }
}
