{
  "$schema": "https://raw.githubusercontent.com/dawidsok/dim-sum-theme/main/scheme/schema.json",
  "name": "Dim Sum Mono Light",
  "slug": "dim-sum-mono-light",
  "appearance": "light",
  "description": "A restrained monochrome light Dim Sum variant with soft paper contrast and minimal accents.",
  "colors": {
    "bg": "#f0eee8",
    "bg1": "#e7e4dc",
    "bg2": "#dcddd4",
    "bg3": "#cbc7bc",
    "bg4": "#b9b4a7",
    "dim": "#9a9488",
    "mid": "#746f66",
    "fg": "#494640",
    "fg1": "#393630",
    "white": "#24231f",
    "red": "#926767",
    "orange": "#927967",
    "yellow": "#8d8260",
    "green": "#748064",
    "cyan": "#657f7c",
    "blue": "#6c7687",
    "purple": "#7e7488",
    "magenta": "#88717d",
    "brightRed": "#a87878",
    "brightGreen": "#849273",
    "brightYellow": "#a09470",
    "brightBlue": "#7d889c",
    "brightPurple": "#90849c",
    "brightCyan": "#75918d"
  },
  "ansi": {
    "black": "fg1",
    "red": "red",
    "green": "green",
    "yellow": "yellow",
    "blue": "blue",
    "magenta": "purple",
    "cyan": "cyan",
    "white": "bg2",
    "brightBlack": "mid",
    "brightRed": "brightRed",
    "brightGreen": "brightGreen",
    "brightYellow": "brightYellow",
    "brightBlue": "brightBlue",
    "brightMagenta": "brightPurple",
    "brightCyan": "brightCyan",
    "brightWhite": "bg"
  },
  "ui": {
    "background": "bg",
    "foreground": "fg",
    "cursor": "white",
    "cursorText": "bg",
    "selectionBackground": "bg3",
    "selectionForeground": "white",
    "border": "bg3",
    "borderMuted": "dim",
    "lineNumber": "dim",
    "lineNumberActive": "white",
    "panel": "bg1",
    "panelAlt": "bg2"
  },
  "syntax": {
    "comment": "mid",
    "keyword": "fg1",
    "function": "fg1",
    "string": "fg",
    "number": "fg",
    "constant": "fg",
    "type": "fg1",
    "property": "fg",
    "punctuation": "mid",
    "operator": "fg1",
    "preproc": "fg1",
    "error": "red",
    "warning": "yellow",
    "info": "blue",
    "hint": "cyan",
    "added": "green",
    "changed": "yellow",
    "removed": "red"
  }
}
