{
  "$schema": "https://raw.githubusercontent.com/dawidsok/dim-sum-theme/main/scheme/schema.json",
  "name": "Dim Sum Darker",
  "slug": "dim-sum-darker",
  "appearance": "dark",
  "description": "A darker restrained Dim Sum variant with grayscale UI and low-saturation semantic accents.",
  "colors": {
    "bg": "#111111",
    "bg1": "#1a1a1a",
    "bg2": "#242424",
    "bg3": "#303030",
    "bg4": "#3c3c3c",
    "dim": "#565656",
    "mid": "#858585",
    "fg": "#c9c9c9",
    "fg1": "#d8d8d8",
    "white": "#eeeeee",
    "red": "#a46f6f",
    "orange": "#a4876f",
    "yellow": "#a49a6f",
    "green": "#82906f",
    "cyan": "#71908d",
    "blue": "#7b8798",
    "purple": "#8d8298",
    "magenta": "#987f8e",
    "brightRed": "#bb8383",
    "brightGreen": "#95a482",
    "brightYellow": "#b9ae82",
    "brightBlue": "#8e9aae",
    "brightPurple": "#a195ae",
    "brightCyan": "#84a4a0"
  },
  "ansi": {
    "black": "bg",
    "red": "red",
    "green": "green",
    "yellow": "yellow",
    "blue": "blue",
    "magenta": "purple",
    "cyan": "cyan",
    "white": "fg",
    "brightBlack": "dim",
    "brightRed": "brightRed",
    "brightGreen": "brightGreen",
    "brightYellow": "brightYellow",
    "brightBlue": "brightBlue",
    "brightMagenta": "brightPurple",
    "brightCyan": "brightCyan",
    "brightWhite": "white"
  },
  "ui": {
    "background": "bg",
    "foreground": "fg",
    "cursor": "white",
    "cursorText": "bg",
    "selectionBackground": "bg3",
    "selectionForeground": "white",
    "border": "bg3",
    "borderMuted": "dim",
    "lineNumber": "dim",
    "lineNumberActive": "white",
    "panel": "bg1",
    "panelAlt": "bg2"
  },
  "syntax": {
    "comment": "mid",
    "keyword": "purple",
    "function": "blue",
    "string": "green",
    "number": "orange",
    "constant": "orange",
    "type": "cyan",
    "property": "cyan",
    "punctuation": "mid",
    "operator": "fg1",
    "preproc": "yellow",
    "error": "red",
    "warning": "yellow",
    "info": "blue",
    "hint": "cyan",
    "added": "green",
    "changed": "yellow",
    "removed": "red"
  }
}
